## Romania Decisions and Events Descriptions ##;;;;;;;;;;;;;;x
EVTDESC15116;The Ju-87D Stuka entered service in 1943 in the 3rd Dive Bomber Group. The group was deployed in early June. An additionnal 6th Dive Bomber Group was raised in May 1944. A total of 160 planes were received by Romania until summer 1944.;;;;;;;;;;;;;;x
Hs129_Bombers_decision_title;Romanian Hs-129.;;;;;;;;;;;;;;x
Hs129_Bombers_decision_desc;This decision will allow you to buy some German close air Support bombers.;;;;;;;;;;;;;;x
EVTDESC15117;Alongside Ju87-D bombers, Romania also ordered some German He-129B planes.;;;;;;;;;;;;;;x
EVTDESC15118;The Hs-129B2 came into ARR service in 1943. It equipped the 8th Assault Group, which previously had been a fighter unit (8th Fighter Group with IAR-80Bs).In 1944, a new assault group (the 11th) started training, but it wasn't ready when Romania changed sides in August, so its elements were used to fill the ranks of the existing assault group. Because of losses and lack of spare parts, the number of available Hs-129B2s decreased. In October 1944 he group was reduced to the 41st Squadron, which was joined with the 74th Squadron (Ju-87D3) and formed the 8th Assault-Dive Bomber Group.;;;;;;;;;;;;;;x
GAL_decision_title;Combat Air Group.;;;;;;;;;;;;;;x
GAL_decision_desc;This decision will give you access to an Aircorps HQ.;;;;;;;;;;;;;;x
EVTDESC15131;The Combat Air Group (Gruparea Aeriana de Lupta) was set up on June 22nd, 1941 with a total of 253 aircraft. It was made of 4 flotillas (1st Bomber Flotilla, 2nd Bomber Flotilla 2nd Observation Flotilla, 1st Fighter Flotilla), grouping a various collection of aircrafts: Italian S-79B, Polish P.37B, French Potez 633B2 and MB-210, German He-111H3, He-112B, Bf-109E and Romanian made planes (IAR-37, IAR-38, IAR-39, IAR-80A).\nTheir mission was to gain air supremacy over Bessarabia and Northern Bukovina and then support the offensive of the Romanian 4th Army. After Besserabia was secured, the CAG assisted in the siege of Odessa.\n\nObselete foreign planes were removed from front service in 1942 and replaced by more modern German aircraft. Combat Air group was reformed into the 1st Air Corps (Corpul 1 Aerian) in 1943.;;;;;;;;;;;;;;x
1st_Aircorps_decision_title;1st Air Corps.;;;;;;;;;;;;;;x
1st_Aircorps_decision_desc;This decision will give you access to an Aircorps HQ.;;;;;;;;;;;;;;x
EVTDESC15132;WIP.;;;;;;;;;;;;;;x
Romania_controls_Beograd_decision_title;Beograd is under our control.;;;;;;;;;;;;;;x
Romania_controls_Beograd_decision_desc;Decide the future of Yougoslavia.;;;;;;;;;;;;;;x
EVTDESC15133;Yougoslavia has surrendered to us. It is time to decide the future of these occupied lands: should they be under Romanian rule?;;;;;;;;;;;;;;x
#EOF;;;;;;;;;;;;;;x